{
  "schema": "audit-health/v1",
  "node_id": "11111111-1111-4111-8111-111111111111",
  "instance_id": "22222222-2222-4222-8222-222222222222",
  "observed_at": "2026-08-27T09:00:00Z",
  "accountd_active": true,
  "db_state": "UNKNOWN",
  "db_schema": null,
  "heartbeat_age_seconds": 1,
  "last_poll_age_seconds": 1,
  "last_event_age_seconds": null,
  "export_seq": null,
  "min_retained_export_seq": 81,
  "pruned_max_export_seq": 80
}
